<?xml version="1.0" encoding="UTF-8"?>
<prodotti xmlns:xsi="http://www.w3.org/2001/XMLSchema-instance" xsi:noNamespaceSchemaLocation="prodotti.xsd"><gioco><idProd>1</idProd><nome>Monopoli</nome><idCateg>1</idCateg><idCasa>1</idCasa><lingua>Italiano</lingua><annoProd>2001</annoProd><prezzo>20</prezzo><img>../images/Monopoli1.png</img><idSconto>1</idSconto></gioco><gioco><idProd>2</idProd><nome>Risiko</nome><idCateg>2</idCateg><idCasa>2</idCasa><lingua>Inglese</lingua><annoProd>1995</annoProd><prezzo>45</prezzo><img>../images/Risiko2.png</img><idSconto>1</idSconto><idSconto>2</idSconto></gioco><gioco><idProd>3</idProd><nome>prova</nome><idCateg>1</idCateg><idCasa>1</idCasa><lingua>Inglese</lingua><annoProd>2000</annoProd><prezzo>2</prezzo><img>../images/prova3.png</img></gioco></prodotti>
